<!ELEMENT recetas (receta*)>
<!ELEMENT receta (ingrediente*)>
<!ELEMENT ingrediente (#PCDATA)>
<!ELEMENT nombre (#PCDATA)>
<!ELEMENT precio (#PCDATA)>